<?xml version="1.0" encoding="UTF-8"?>
<scenario xmlns:xsi="http://www.w3.org/2001/XMLSchema-instance"
    xsi:noNamespaceSchemaLocation="xsd/scenario.xsd">
    <name>Scenario 1</name>
    <description></description>
    <baseURL>http://localhost:8080/scholagest-app/services</baseURL>
    <calls>
        <call>
            <id>1 - Create student</id>
            <url>/student/create</url>
            <parameters>token=1234&amp;keys=pStudentLastName&amp;keys=pStudentFirstName&amp;values=Lavanchy&amp;values=CÃ©dric</parameters>
            <httpMethod>GET</httpMethod>
            <expectedResult>
                <result>
                    <path>info/type</path>
                    <value>http://scholagest.net#tStudent</value>
                </result>
                <result>
                	<path>info/key</path>
                	<storeIn>studentKey</storeIn>
                </result>
            </expectedResult>
        </call>
        <call>
            <id>2 - Read student properties</id>
            <url>/student/getPersonalProperties</url>
            <httpMethod>GET</httpMethod>
            <parameters>token=1234&amp;studentKey=$$studentKey$$</parameters>
            <expectedResult>
            	<result>
            		<path>info/properties/pStudentLastName/value</path>
            		<value>Lavanchy</value>
            	</result>
            </expectedResult>
        </call>
    </calls>
</scenario>