<?xml version="1.0" encoding="UTF-8"?>
<scenario xmlns:xsi="http://www.w3.org/2001/XMLSchema-instance"
    xsi:noNamespaceSchemaLocation="xsd/scenario.xsd">
    <name>User service authentication with invalid token</name>
    <description></description>
    <baseURL>http://localhost:8080/scholagest-app/services</baseURL>
    <initializationFolder>initializer/tester/</initializationFolder>
    <calls>
        <call>
            <id>1 - Authenticate the token</id>
            <url>/user/validateToken</url>
            <httpMethod>POST</httpMethod>
            <parameters>{token:'abcdefghijklm'}</parameters>
            <expectedResult>
                <result>
                    <path>errorCode</path>
                    <value>0.0</value>
                </result>
            </expectedResult>
        </call>
    </calls>
</scenario>